<?xml version="1.0" encoding="utf-8"?>
<template xmlns="http://www.kantega.no" xmlns:xsi="http://www.w3.org/2001/XMLSchema-instance" xsi:schemaLocation="http://www.kantega.no http://www.kantega.no/aksess/aksess-template.xsd">
    <attributes>
        <attribute name="tittel" type="text" mandatory="true" mapto="title"/>
        <attribute name="forsideoversrift" title="Forsideoverskrift" type="text" mandatory="true"/>
        <attribute name="ingress" type="htmltext" mapto="description" title="ingress"/>

        <attribute name="hovedinnhold" type="htmltext" />

        <attribute name="utvalgte" title="Utvalgte artikler" type="contentid" multiple="true" maxitems="15"/>

        <attribute name="viktigutvalgt" title="Eksta viktig utvalgt nyhet. Brukes som et unntak." type="contentid" multiple="false"/>

    </attributes>
</template>
